{
  "visual_signature_receipt_version": 1,
  "project_id": "example-product",
  "surface": "operator-product-ui",
  "status": "approved",
  "signature": {
    "palette": {
      "primary": [
        {"value": "#175CD3", "token": "--color-brand-600", "usage": "primary actions and active selection"}
      ],
      "accent": [
        {"value": "#F04438", "token": "--color-accent-500", "usage": "urgent attention without replacing primary hierarchy"}
      ],
      "background": [
        {"value": "#F8FAFC", "token": "--color-background", "usage": "application canvas"}
      ],
      "surface": [
        {"value": "#FFFFFF", "token": "--color-surface", "usage": "panels and controls"}
      ],
      "text": [
        {"value": "#101828", "token": "--color-text-primary", "usage": "primary labels and values"},
        {"value": "#475467", "token": "--color-text-secondary", "usage": "secondary labels and metadata"}
      ],
      "semantic": [
        {"role": "success", "value": "#079455", "token": "--color-success", "usage": "successful status"},
        {"role": "warning", "value": "#DC6803", "token": "--color-warning", "usage": "warning status"},
        {"role": "danger", "value": "#D92D20", "token": "--color-danger", "usage": "failed or destructive status"}
      ]
    },
    "typography": {
      "families": [
        {"family": "Inter", "role": "operator labels, data, and controls"}
      ],
      "scale": "compact operator hierarchy",
      "weights": ["400", "500", "600"],
      "treatments": ["tabular numerals", "compact labels", "strong action hierarchy"]
    },
    "density": {
      "mode": "compact",
      "characteristics": ["same-screen comparison", "short control rows", "high information density"]
    },
    "shape": {
      "radii": ["4px controls", "8px panels"],
      "geometry": ["restrained rectangles", "clear table and panel edges"],
      "strokes": ["1px neutral control and panel strokes"]
    },
    "elevation": {
      "strategy": "layered",
      "shadows": ["single low-elevation shadow on overlays"],
      "separation": ["surface contrast", "panel strokes", "overlay shadow"]
    },
    "imagery": {
      "strategy": "functional",
      "characteristics": ["status and data imagery only", "no decorative editorial texture"]
    },
    "motion": {
      "intensity": "restrained",
      "characteristics": ["state confirmation", "focus transitions", "no ornamental drift"]
    },
    "style_keywords": ["operational", "data-dense", "high-clarity", "brand-blue"],
    "forbidden_transformations": [
      "replace brand blue with neutral gray or paper beige",
      "replace compact operator density with spacious consumer cards",
      "remove all depth or shadows globally",
      "introduce editorial texture or magazine composition",
      "derive a new palette from color frequency alone"
    ]
  },
  "authority": {
    "kind": "owner-direction",
    "authority_id": "example-owner",
    "basis": "The approved operator token contract fixes the exact visual signature and explicitly rejects generic neutralization.",
    "decided_at": "2026-08-18T00:00:00.000Z"
  },
  "evidence": [
    {
      "kind": "design-tokens",
      "path": "visual-style-contract.json",
      "digest": "sha256:c022a661f5ddf21fac5a1bce552d3afc94ddd90d63c1ff1aa8cbfa8203ed27e2"
    },
    {
      "kind": "owner-approval",
      "path": "visual-signature-owner-approval.json",
      "digest": "sha256:1e462f5507d293622be31b39548cc6206d7519069d15a323dcf1c95452ba645e"
    }
  ],
  "coverage": [
    {"aspect": "palette", "evidence_paths": ["visual-style-contract.json"]},
    {"aspect": "typography", "evidence_paths": ["visual-style-contract.json"]},
    {"aspect": "density", "evidence_paths": ["visual-style-contract.json"]},
    {"aspect": "shape", "evidence_paths": ["visual-style-contract.json"]},
    {"aspect": "elevation", "evidence_paths": ["visual-style-contract.json"]},
    {"aspect": "imagery", "evidence_paths": ["visual-style-contract.json"]},
    {"aspect": "motion", "evidence_paths": ["visual-style-contract.json"]},
    {"aspect": "style_keywords", "evidence_paths": ["visual-style-contract.json"]},
    {"aspect": "forbidden_transformations", "evidence_paths": ["visual-style-contract.json", "visual-signature-owner-approval.json"]}
  ]
}
